<?xml version="1.0" encoding="UTF-8"?>
<!DOCTYPE menu SYSTEM "foodex-menu.dtd">
<menu>
  <item id="M001"><name>Chicken Biryani</name><category>Biryani</category><restaurant>Spice Garden</restaurant><price>300</price><image>https://images.unsplash.com/photo-1631515242808-497c3fbd3972?auto=format&amp;fit=crop&amp;w=900&amp;q=80</image></item>
  <item id="M002"><name>Paneer Tikka</name><category>North Indian</category><restaurant>Spice Garden</restaurant><price>260</price><image>https://images.unsplash.com/photo-1567188040759-fb8a883dc6d8?auto=format&amp;fit=crop&amp;w=900&amp;q=80</image></item>
  <item id="M003"><name>Garlic Naan</name><category>North Indian</category><restaurant>Spice Garden</restaurant><price>120</price><image>https://images.unsplash.com/photo-1601050690597-df0568f70950?auto=format&amp;fit=crop&amp;w=900&amp;q=80</image></item>
  <item id="M004"><name>Butter Chicken</name><category>North Indian</category><restaurant>Spice Garden</restaurant><price>340</price><image>https://images.unsplash.com/photo-1603894584373-5ac82b2ae398?auto=format&amp;fit=crop&amp;w=900&amp;q=80</image></item>
  <item id="M005"><name>Margherita Pizza</name><category>Pizza</category><restaurant>Pizza Zone</restaurant><price>400</price><image>https://images.unsplash.com/photo-1574071318508-1cdbab80d002?auto=format&amp;fit=crop&amp;w=900&amp;q=80</image></item>
  <item id="M006"><name>Farmhouse Pizza</name><category>Pizza</category><restaurant>Pizza Zone</restaurant><price>480</price><image>https://images.unsplash.com/photo-1579751626657-72bc17010498?auto=format&amp;fit=crop&amp;w=900&amp;q=80</image></item>
  <item id="M007"><name>Garlic Bread</name><category>Fast Food</category><restaurant>Pizza Zone</restaurant><price>180</price><image>https://images.unsplash.com/photo-1573140401552-388e9cdfc7cc?auto=format&amp;fit=crop&amp;w=900&amp;q=80</image></item>
  <item id="M008"><name>Pesto Veg Pizza</name><category>Pizza</category><restaurant>Pizza Zone</restaurant><price>460</price><image>https://images.unsplash.com/photo-1593560708920-61dd98c8a9e4?auto=format&amp;fit=crop&amp;w=900&amp;q=80</image></item>
  <item id="M009"><name>Classic Chicken Burger</name><category>Burgers</category><restaurant>The Burger House</restaurant><price>200</price><image>https://images.unsplash.com/photo-1568901346375-23c9450c58cd?auto=format&amp;fit=crop&amp;w=900&amp;q=80</image></item>
  <item id="M010"><name>Veggie Crunch Burger</name><category>Burgers</category><restaurant>The Burger House</restaurant><price>180</price><image>https://images.unsplash.com/photo-1520072959219-c595dc870360?auto=format&amp;fit=crop&amp;w=900&amp;q=80</image></item>
  <item id="M011"><name>Loaded Fries</name><category>Fast Food</category><restaurant>The Burger House</restaurant><price>150</price><image>https://images.unsplash.com/photo-1573080496219-bb080dd4f877?auto=format&amp;fit=crop&amp;w=900&amp;q=80</image></item>
  <item id="M012"><name>Masala Dosa</name><category>South Indian</category><restaurant>Dosa Corner</restaurant><price>160</price><image>https://images.unsplash.com/photo-1668236543090-82eba5ee5976?auto=format&amp;fit=crop&amp;w=900&amp;q=80</image></item>
  <item id="M013"><name>Idli Sambar</name><category>South Indian</category><restaurant>Dosa Corner</restaurant><price>110</price><image>https://images.unsplash.com/photo-1589301760014-d929f3979dbc?auto=format&amp;fit=crop&amp;w=900&amp;q=80</image></item>
  <item id="M014"><name>Paneer Dosa</name><category>South Indian</category><restaurant>Dosa Corner</restaurant><price>190</price><image>https://images.unsplash.com/photo-1630383249896-424e482df921?auto=format&amp;fit=crop&amp;w=900&amp;q=80</image></item>
  <item id="M015"><name>Veg Hakka Noodles</name><category>Noodles</category><restaurant>Wok &amp; Bowl</restaurant><price>220</price><image>https://images.unsplash.com/photo-1512058564366-18510be2db19?auto=format&amp;fit=crop&amp;w=900&amp;q=80</image></item>
  <item id="M016"><name>Chicken Fried Rice</name><category>Asian</category><restaurant>Wok &amp; Bowl</restaurant><price>260</price><image>https://images.unsplash.com/photo-1603133872878-684f208fb84b?auto=format&amp;fit=crop&amp;w=900&amp;q=80</image></item>
  <item id="M017"><name>Chilli Paneer</name><category>Asian</category><restaurant>Wok &amp; Bowl</restaurant><price>240</price><image>https://images.unsplash.com/photo-1601050690117-94f5f6fa8bd7?auto=format&amp;fit=crop&amp;w=900&amp;q=80</image></item>
  <item id="M018"><name>Chocolate Cake</name><category>Desserts</category><restaurant>Sweet Cravings</restaurant><price>180</price><image>https://images.unsplash.com/photo-1578985545062-69928b1d9587?auto=format&amp;fit=crop&amp;w=900&amp;q=80</image></item>
  <item id="M019"><name>Strawberry Cheesecake</name><category>Desserts</category><restaurant>Sweet Cravings</restaurant><price>220</price><image>https://images.unsplash.com/photo-1565958011703-44f9829ba187?auto=format&amp;fit=crop&amp;w=900&amp;q=80</image></item>
  <item id="M020"><name>Cold Coffee</name><category>Beverages</category><restaurant>Sweet Cravings</restaurant><price>140</price><image>https://images.unsplash.com/photo-1461023058943-07fcbe16d735?auto=format&amp;fit=crop&amp;w=900&amp;q=80</image></item>
</menu>